{
  "schema_version": "1.0",
  "job_id": "b5525bd8-740e-4ca9-b6e4-a32654f155c9",
  "analysis_profile": "general_environmental_results",
  "takeoff_filename": "takeoff.bhom.json",
  "template_materials_filename": "template-materials.bhom.json",
  "prioritise_template_materials": true,
  "metric_filters": ["ClimateChangeTotal"],
  "modules": ["A1toA3"],
  "project": {
    "project_id": "revit-material-lookup",
    "project_name": "Revit material lookup integration",
    "gross_floor_area_m2": 1000.0
  }
}
